{
  "kind": "swimlane",
  "title": "Взаимодействие федеральных законов в исполнительном производстве",
  "subtitle": "Столбцы — этапы ИП · строки — участники · золотая дорожка — зона ответственности банка",
  "source_norm": "229-ФЗ ст. 7, 12, 21–22, 30–31, 40, 46–47, 64, 70 ч. 5, 96, 110–111 (ред. 04.08.2026); НК РФ ч.1 ст. 46, 59, 60, 135; ГК РФ ч.2 ст. 855; 127-ФЗ ст. 69.1, 223.2; 425-ФЗ ст. 1, 17, 20; 603-ФЗ ст. 4",
  "checklist_ref": "law-ingest/id_sources.json",
  "lanes": [
    {"id": "court", "title": "Суд / иной орган, выдавший ИД"},
    {"id": "fns", "title": "ФНС (налоговый орган)"},
    {"id": "claimant", "title": "Взыскатель"},
    {"id": "bailiff", "title": "Судебный пристав-исполнитель (ФССП)"},
    {"id": "bank", "title": "БАНК / кредитная организация — зона ответственности", "highlight": true},
    {"id": "debtor", "title": "Должник"},
    {"id": "arbiter", "title": "Арбитражный суд / управляющий (127-ФЗ)"}
  ],
  "stages": [
    {"id": "s1", "title": "Выдача ИД", "norms": "ст. 12–13"},
    {"id": "s2", "title": "Предъявление ИД", "norms": "ст. 7, 8, 21–22"},
    {"id": "s3", "title": "Возбуждение ИП", "norms": "ст. 30–31 · НК ст. 46"},
    {"id": "s4", "title": "Принудительное исполнение", "norms": "ст. 64, 68, 70 · НК ст. 46/135"},
    {"id": "s5", "title": "Очерёдность и распределение", "norms": "ст. 110–111 · ГК ст. 855"},
    {"id": "s6", "title": "Окончание / приостановление", "norms": "ст. 46–47, 40, 96 · 127-ФЗ"}
  ],
  "steps": [
    {"lane": "court", "stage": "s1", "norm": "229-ФЗ ст. 12–13", "text": "Выдача ИД: исп. лист, судебный приказ, нотариальные соглашения, удостоверения КТС/финуполномоченного, акты СФР и контрольных органов, постановления ФНС/пристава"},
    {"lane": "fns", "stage": "s1", "norm": "229-ФЗ п. 5.2 ч. 1 ст. 12", "text": "Постановление ФНС о взыскании задолженности — самостоятельный вид ИД"},
    {"lane": "bailiff", "stage": "s1", "norm": "229-ФЗ п. 7 ч. 1 ст. 12", "text": "Постановление пристава/ФССП — самостоятельный вид ИД"},
    {"lane": "claimant", "stage": "s2", "norm": "229-ФЗ ст. 21–22", "text": "Предъявление ИД к исполнению (сроки, перерыв срока)"},
    {"lane": "bank", "stage": "s2", "norm": "229-ФЗ ст. 7, 8", "text": "ИД предъявлен напрямую в банк (минуя пристава)"},
    {"lane": "bailiff", "stage": "s3", "norm": "229-ФЗ ст. 30 ч. 1, ст. 31 ч. 1", "text": "Возбуждение ИП по заявлению взыскателя; отказ — в 3 дня"},
    {"lane": "fns", "stage": "s3", "norm": "НК ч.1 ст. 46 (ред. 425-ФЗ)", "text": "Взыскание через реестр решений; ПНО в банк; размещение = получение банком"},
    {"lane": "bailiff", "stage": "s4", "norm": "229-ФЗ ст. 64, 68, 70 ч. 5", "text": "Обращение взыскания на денежные средства; постановление в банк"},
    {"lane": "bank", "stage": "s4", "norm": "229-ФЗ ст. 70 ч. 5", "text": "Незамедлительное исполнение требований о взыскании денежных средств"},
    {"lane": "bank", "stage": "s4", "norm": "НК ч.1 п. 6 ст. 46; п. 2 ст. 60", "text": "ПНО: 3 часа (ред. 425-ФЗ, с 01.01.2027) / 1 операционный день (ст. 60)"},
    {"lane": "bank", "stage": "s4", "norm": "НК ч.1 ст. 135", "text": "Ответственность банка: 1/150 ставки, ≤0,2%/день; 30% за создание отсутствия средств"},
    {"lane": "bailiff", "stage": "s5", "norm": "229-ФЗ ст. 110", "text": "Распределение взысканных средств (депозитный счёт службы приставов)"},
    {"lane": "bank", "stage": "s5", "norm": "229-ФЗ ст. 111 · ГК ч.2 ст. 855", "text": "Очерёдность списания денежных средств со счёта должника"},
    {"lane": "bailiff", "stage": "s6", "norm": "229-ФЗ ст. 47, 46", "text": "Окончание ИП; возврат ИД взыскателю при невозможности взыскания"},
    {"lane": "claimant", "stage": "s6", "norm": "229-ФЗ ст. 46 ч. 4", "text": "Извещение взыскателя; повторное предъявление ИД"},
    {"lane": "fns", "stage": "s6", "norm": "НК ч.1 ст. 59", "text": "Списание безнадёжной задолженности (при возврате ИД по п. 3/4 ч. 1 ст. 46)"},
    {"lane": "arbiter", "stage": "s6", "norm": "229-ФЗ ст. 96 ч. 1, ст. 40 ч.1 п.5.2 · 127-ФЗ ст. 69.1, 223.2", "text": "Банкротство: взыскание по ИД приостанавливается; внесудебное банкротство гражданина"}
  ],
  "relations": [
    {"from": "FZ-425:20", "to": "NK-1:46", "type": "refers", "curated": true, "note": "переходное положение; 1/2 оп.дня; priority lex_specialis (проект)"},
    {"from": "FZ-425:17", "to": "NK-1:46", "type": "refers", "curated": true, "note": "переходное положение о цифровом рубле 01.06.2026–31.12.2026"},
    {"from": "FZ-425:1", "to": "NK-1:46", "type": "amends", "curated": false, "note": "правка ст. 46: реестр решений"},
    {"from": "NK-1:60", "to": "NK-1:46", "type": "procedure", "curated": true, "note": "ст. 60 — процедурная реализация поручения по ст. 46"},
    {"from": "NК-1:59", "to": "FZ-229:46", "type": "refers", "curated": true, "note": "списание безнадёжной при возврате ИД"},
    {"from": "FZ-229:111", "to": "GK-2:855", "type": "refers", "curated": true, "note": "очерёдность списания банком"}
  ],
  "verdict": "ПРИНЯТ (fz425-verifier, 12/12 фактов и 11/11 связей)"
}
