{
  "kind": "swimlane",
  "title": "Путь исполнительного документа — взаимодействие ФЗ (дорожки участников)",
  "subtitle": "Столбцы — этапы ЖЦ ИД · строки — участники · золотая дорожка — зона ответственности банка",
  "source_norm": "229-ФЗ ст. 8, 12–13, 21–22, 30–31, 36, 43, 46–47; НК РФ ч.1 ст. 46, 59, 60, 135; ГК РФ ч.2 ст. 855; 127-ФЗ; 425-ФЗ",
  "checklist_ref": "law-ingest/id_sources.json",
  "lanes": [
    {"id": "court", "title": "Суд / иной орган, выдавший ИД"},
    {"id": "fns", "title": "ФНС (налоговый орган)"},
    {"id": "claimant", "title": "Взыскатель"},
    {"id": "bailiff", "title": "Судебный пристав (ФССП)"},
    {"id": "bank", "title": "БАНК — зона ответственности", "highlight": true},
    {"id": "debtor", "title": "Должник"}
  ],
  "stages": [
    {"id": "s1", "title": "Выдача ИД", "norms": "ст. 12–13"},
    {"id": "s2", "title": "Предъявление", "norms": "ст. 21–22"},
    {"id": "s3", "title": "Возбуждение ИП", "norms": "ст. 30–31"},
    {"id": "s4", "title": "Добровольное", "norms": "5 дней · ст. 30 ч. 11–12"},
    {"id": "s5", "title": "Принудительное", "norms": "ст. 36, 64, 68"},
    {"id": "s6", "title": "Окончание / возврат", "norms": "ст. 47 / 46 / 43"}
  ],
  "steps": [
    {"lane": "court", "stage": "s1", "norm": "229-ФЗ ст. 12–13", "text": "Выдача ИД: исп. лист, судебный приказ, нотариальное соглашение"},
    {"lane": "fns", "stage": "s1", "norm": "229-ФЗ п. 5.2 ст. 12", "text": "Постановление ФНС о взыскании задолженности"},
    {"lane": "bailiff", "stage": "s1", "norm": "229-ФЗ п. 7 ч. 1 ст. 12", "text": "Постановление пристава/ФССП — самостоятельный вид ИД"},
    {"lane": "claimant", "stage": "s2", "norm": "229-ФЗ ст. 21–22", "text": "Предъявление ИД к исполнению (сроки, перерыв)"},
    {"lane": "bank", "stage": "s2", "norm": "229-ФЗ ст. 8", "text": "ИД предъявлен напрямую в банк"},
    {"lane": "bailiff", "stage": "s3", "norm": "229-ФЗ ст. 30–31", "text": "Возбуждение ИП (3 дня); отказ"},
    {"lane": "debtor", "stage": "s4", "norm": "229-ФЗ ст. 30 ч. 11–12", "text": "Добровольное исполнение (5 дней)"},
    {"lane": "bailiff", "stage": "s5", "norm": "229-ФЗ ст. 36, 64, 68", "text": "Принудительное взыскание приставом"},
    {"lane": "fns", "stage": "s5", "norm": "НК ч.1 ст. 46/60", "text": "Поручение ФНС в банк (реестр решений)"},
    {"lane": "bank", "stage": "s5", "norm": "НК 46/60 · ГК ч.2 ст. 855", "text": "Списание · очерёдность · ст. 60 · розыск счетов · ст. 135"},
    {"lane": "bailiff", "stage": "s6", "norm": "229-ФЗ ст. 47/46/43", "text": "Окончание ИП: исполнено / возврат / прекращение"},
    {"lane": "claimant", "stage": "s6", "norm": "229-ФЗ ст. 46 ч. 4", "text": "Возврат ИД взыскателю / повторное предъявление"},
    {"lane": "bank", "stage": "s6", "norm": "НК ст. 60", "text": "Подтверждение исполнения / сообщение о неисполнении"}
  ],
  "relations": [
    {"from": "FZ-425:20", "to": "NK-1:46", "type": "refers", "curated": true, "note": "переходное положение; эффект с 01.01.2027"},
    {"from": "FZ-229:111", "to": "GK-2:855", "type": "refers", "curated": true, "note": "очерёдность списания"},
    {"from": "NK-1:60", "to": "NK-1:46", "type": "procedure", "curated": true}
  ],
  "verdict": "ПРИНЯТ (fz425-verifier)"
}
